"id","ep_num","segment","title","role","text"
8050236,805,30,"AWESOM O","BUTTERS","Yeah, me and my robot are still over at the movie studio, Aunt Nellie. We're makin' all sorts of money for the poor."
8050237,805,31,"AWESOM O","description","The boardroom. Cartman is pitching more movie ideas."
8050238,805,31,"AWESOM O","CARTMAN","Movie idea number two thousand three hundred and five: Adam Sandler is trapped on an island and falls in love with a coconut."
8050239,805,31,"AWESOM O","PRODUCER","Great, AWESOM-O, great. Uh guys, take a break. I need a minute alone with AWESOM-O.  You are an incredible robot, AWESOM-O. I was just wondering... are you by chance a ...pleasure model?"
8050240,805,31,"AWESOM O","CARTMAN","...What?"
8050241,805,31,"AWESOM O","PRODUCER","Well, have you been programmed to... satisfy... urges of humans?"
8050242,805,31,"AWESOM O","CARTMAN","AWESOM-O does not understand."
8050243,805,31,"AWESOM O","PRODUCER","Let me show you what I mean."
8050244,805,32,"AWESOM O","description","Catamount Pictures lobby"
8050245,805,32,"AWESOM O","BUTTERS","Well yeah, we're havin' a great time, Aunt Nellie. These movie studio guys are real nice."
8050246,805,32,"AWESOM O","CARTMAN","LAME!"
8050247,805,32,"AWESOM O","BUTTERS","Yeah, we're makin' a bunch more money. I can't believe it either."
8050248,805,32,"AWESOM O","CARTMAN","NOT COOL! TOTALLY LAME!"
8050249,805,32,"AWESOM O","BUTTERS","AWESOM-O? Well, I gotta go, Aunt Nellie. Ah, AWESOM-O is havin' some kind of malfunction.  AWESOM-O? Hey, where'd ya go?"
8050250,805,32,"AWESOM O","CARTMAN","Waaaaa!"
8050251,805,32,"AWESOM O","SOLDIER","Let's go! Move, move!"
8050252,805,32,"AWESOM O","BUTTERS","AWESOM-O?  Hey, what are you doin' with him?!  That's my robot!  AWESOM-OOOOOOOOOOOOOO!!!"
8050253,805,33,"AWESOM O","description","A military base near Los Angeles. In a warehouse, AWESOM-O, shackled onto a platform, is raised from a horizontal position to vertical. Two soldiers approach on either side of Cartman and tighten the locks on him"
8050254,805,33,"AWESOM O","GENERAL","Are those arm and leg locks secure?"
8050255,805,33,"AWESOM O","SOLDIER","Secure, sir!"
8050256,805,33,"AWESOM O","GENERAL","Good. I don't want that robot mobile until I know what it's capable of. All right, power it on."
8050257,805,33,"AWESOM O","CARTMAN","Whoa whoa whoa whoa whoa!"
8050258,805,33,"AWESOM O","SCIENTIST","What the hell?"
8050259,805,33,"AWESOM O","GENERAL","What's going on?"
8050260,805,33,"AWESOM O","SCIENTIST","It... powered itself back on."
8050261,805,33,"AWESOM O","GENERAL","Stand by. Be ready to destroy it."
8050262,805,33,"AWESOM O","CARTMAN","Where the hell am I?! Hey, why can't I move?!"
8050263,805,33,"AWESOM O","SCIENTIST","Are your systems stable? Run a systems check on your CPU."
8050264,805,33,"AWESOM O","CARTMAN","The fuck are you talkin' about, dude?!"
8050265,805,33,"AWESOM O","SCIENTIST","Ah, I'm sorry, robot,  they want me to reprogram you."
8050266,805,33,"AWESOM O","CARTMAN","I'm not a robot, dumbass! I'm alive!"
8050267,805,33,"AWESOM O","SCIENTIST","What did you say?"
8050268,805,33,"AWESOM O","CARTMAN","I said I'm a real person, asswipe!"
8050269,805,33,"AWESOM O","SCIENTIST","...Oh my God."
8050270,805,33,"AWESOM O","GENERAL","What's happening?"
8050271,805,33,"AWESOM O","SCIENTIST","The robot... It thinks it's alive. It's developed consciousness."
8050272,805,33,"AWESOM O","GENERAL","What? How can that be?"
8050273,805,33,"AWESOM O","SCIENTIST","Must be a malfunction of its exographical IMS or the... interlaced BV system."
8050274,805,33,"AWESOM O","GENERAL","Speak in a language we can understand, Mr. Scientist!"
8050275,805,33,"AWESOM O","SCIENTIST","Your robot doesn't know it's a robot!"
8050276,805,33,"AWESOM O","CARTMAN","Goddamnit, get me down from here!"
8050277,805,33,"AWESOM O","GENERAL","Who made you, robot?!"
8050278,805,33,"AWESOM O","CARTMAN","I'm not a robot, I'm a human!"
8050279,805,33,"AWESOM O","WHITE OFFICIAL","Jesus, the scientist was right."
8050280,805,33,"AWESOM O","GENERAL","But, who would have programmed it to think it was human? The movie studio?"
8050281,805,33,"AWESOM O","CARTMAN","Look, retards! My name is Eric Cartman! I live with my mom in South Park, Colorado!"
8050282,805,33,"AWESOM O","GENERAL","Dear Christ, they gave it memories, too."
8050283,805,33,"AWESOM O","SCIENTIST","Sure, why not? Program the memories of some eight-year-old boy who doesn't exist, and make the robot think he's real! Makes for a lot better movies! I'm not reprogramming a robot that's developed consciousness!"
8050284,805,33,"AWESOM O","GENERAL","Do I have to remind you of your position?! Don't forget you have a duty to your country,  Mr. Scientist!! I want that robot's memories and consciousness E-RASED, so we can take it back to Washington! GOT IT?!"
8050285,805,33,"AWESOM O","SCIENTIST","Damn you all to hell!.."
8050286,805,34,"AWESOM O","description","Los Angeles. Butters walks down a sidwalk alone with his head down"
8050287,805,34,"AWESOM O","BUTTERS","Hey there, did you know I had a robot friend?"
8050288,805,34,"AWESOM O","We used to laugh and play, but someone took him away.",""
8050289,805,34,"AWESOM O","He was my ten gigahertz old pal.",""
8050290,805,34,"AWESOM O","My robot friend.",""
8050291,805,34,"AWESOM O","BUTTERS","Hey, wait a minute.  Why, that's the van that-  Oh my God!"
8050292,805,35,"AWESOM O","description","The military base, warehouse. The scientist has positioned AWESOM-O so his head can be drilled into, and a huge drill bit begins to descend towards him."
8050293,805,35,"AWESOM O","CARTMAN","Goddamnit, stop! I'm real! I'm real!"
8050294,805,35,"AWESOM O","SOLDIER","It'll all be over soon, robot!"
8050295,805,35,"AWESOM O","SCIENTIST","Hang on! I'm getting you out of here, robot!"
8050296,805,35,"AWESOM O","CARTMAN","Aw, it's about freaking time, jackass!"
8050297,805,35,"AWESOM O","GENERAL","What the hell are you doing?!"
8050298,805,35,"AWESOM O","SCIENTIST","Well I, I'm saving a conscious being! If you wanna kill it, you'll have to go through me!"
8050299,805,35,"AWESOM O","GENERAL","Fine. Kill that son of a bitch!"
8050300,805,35,"AWESOM O","CARTMAN","No! Look, Goddamnit! Now I can show you stupid assholes who I really am!"
8050301,805,35,"AWESOM O","BUTTERS","AWESOM-O!"
8050302,805,35,"AWESOM O","CARTMAN","I am the AWESOM-O 4000."
8050303,805,35,"AWESOM O","BUTTERS","No!!  No, please!  Don't kill him! He's my best friend! He's my best friend in the whole world!"
8050304,805,35,"AWESOM O","SCIENTSIT","There. You see? You want to tell me this isn't humanity? Who's to judge what makes somethng human anyway?! Does this make me human?!  Or this?! Or these?!"
8050305,805,35,"AWESOM O","GENERAL","Perhaps... there is consciousness in this robot. Maybe we as a society need to realize that artificial intelligence... is intelligence all the same, and we can learn from the robots. I think maybe one day we can all-  Heh- wait a minute, did, did that robot just fart?"
8050306,805,35,"AWESOM O","BUTTERS","Hey, robots don't fart!"
8050307,805,35,"AWESOM O","CARTMAN","Uh... now ending fart sequence."
8050308,805,35,"AWESOM O","GENERAL","Oh, and it, it smells, too!"
8050309,805,35,"AWESOM O","CARTMAN","Smell sequence initiated."
8050310,805,35,"AWESOM O","BLACK OFFICIAL","A robot with smelly farts? That doesn't make any sense."
8050311,805,35,"AWESOM O","BUTTERS","Hang on a second here!"
8050312,805,36,"AWESOM O","description","A room somewhere. A portable screen is put up and the videotape of Cartman acting strange in his backyard is being shown. The sound of laughing kids is heard. On the tape, Cartman is dancing around like Britney Spears"
8050313,805,36,"AWESOM O","CARTMAN",""
8050314,805,36,"AWESOM O","Would you like to touch my body?",""
8050315,805,36,"AWESOM O","Come on and touch my body!",""
8050316,805,36,"AWESOM O","Oooo, my hot body!",""
8050317,805,36,"AWESOM O","Don't you like my hot body?",""
8050318,805,36,"AWESOM O","Come on and touch my titties!",""
8050319,805,36,"AWESOM O","I felt them just like ???",""
8050320,805,36,"AWESOM O","Come on Justin, touch my body! [begins dancing with a life-size ","cutout of Justin Timberlake]"
8050321,805,36,"AWESOM O","Mmm, Justin, yeah!",""
8050322,805,36,"AWESOM O","Touch my body! You and me!",""
8050323,805,36,"AWESOM O","Check it out, my not-hot body!",""
8050324,805,36,"AWESOM O","Come on, my body!",""
8050325,805,36,"AWESOM O","GENERAL","Wow, kid, you're a little faggot!"
8050326,805,36,"AWESOM O","CARTMAN","Lame..."
