"id","ep_num","segment","title","role","text"
8080235,808,23,"DOUCHE AND TURD","JIM LEHRER","Welcome to the cable-access televised debate between a giant douche  and a turd sandwich  We'll start with Giant Douche. Sir, some students and parents are reluctant to have a... giant douche represent them. What do you say to those people?"
8080236,808,23,"DOUCHE AND TURD","GIANT DOUCHE","Jim, first of all I would like to thank you for monitoring this debate. And I would like to thank all of the students and their parents for coming."
8080237,808,23,"DOUCHE AND TURD","CARTMAN","Aww, suck-up, suck-up!  What?! It's an obvious suck-up move."
8080238,808,23,"DOUCHE AND TURD","GIANT DOUCHE","But I would hope that those students and their parents who question my qualities would simply look at my opponent. He is a turd sandwich"
8080239,808,23,"DOUCHE AND TURD","TURD SANDWICH","You're a turd sandwich."
8080240,808,23,"DOUCHE AND TURD","GIANT DOUCHE","... No, sir, if you'll pardon me, you are in fact, the turd sandwich."
8080241,808,23,"DOUCHE AND TURD","TURD SANDWICH","You're a turd sandwich."
8080242,808,23,"DOUCHE AND TURD","GIANT DOUCHE","... Sir, you are a turd sandwich."
8080243,808,23,"DOUCHE AND TURD","TURD SANDWICH","You're a turd sandwich."
8080244,808,23,"DOUCHE AND TURD","JIM LEHRER","Ahh, Turd Sandwich, I will ask you not to speak out of turn."
8080245,808,23,"DOUCHE AND TURD","TURD SANDWICH","I I'm sorry, Jim."
8080246,808,23,"DOUCHE AND TURD","GIANT DOUCHE","Anyway, as I was saying, ahh... wait, I I forgot what I was saying."
8080247,808,23,"DOUCHE AND TURD","TURD SANDWICH","Ha. Wha-hat a douche."
8080248,808,23,"DOUCHE AND TURD","JIM LEHRER","All right, Turd Sandwich, this next question is for you. How should South Park Elementary enforce its laws of conduct for young athletes during sporting events."
8080249,808,23,"DOUCHE AND TURD","TURD SANDWICH","... Uh you know, uh, my opponent wouldn't even know the answer to that question. If you ask him the same question, he would not answer it.  He would stand around and just babble on and on about nothing until he was finally saved by the buzzer sound."
8080250,808,23,"DOUCHE AND TURD","JIM LEHRER","Your time is up, Turd."
8080251,808,24,"DOUCHE AND TURD","description","The PETA compound, next morning. Stan scrubs away at the empty tubs and buckets of food the animals ate from the previous day. The bald man approachs"
8080252,808,24,"DOUCHE AND TURD","BALDING MAN","Stan, I want to introduce you to my stepdaughter, Teresa.  She seems to have taken a liking to you.  And she's ovulating."
8080253,808,24,"DOUCHE AND TURD","STAN","Ahh no thanks, that's okay."
8080254,808,24,"DOUCHE AND TURD","BALDING MAN","Stan, some PETA members are growing concerned that maybe you don't love animals."
8080255,808,24,"DOUCHE AND TURD","STAN","I do love animals, just ...nnot like you guys do."
8080256,808,24,"DOUCHE AND TURD","BALDING MAN","You... don't belong here, Stan. You should return home."
8080257,808,24,"DOUCHE AND TURD","STAN","I can't. I was banished for not voting."
8080258,808,24,"DOUCHE AND TURD","BALDING MAN","But, why on earth wouldn't you wanna vote?"
8080259,808,24,"DOUCHE AND TURD","STAN","I think voting is great. I just didn't care this time because it was between a giant douche and a turd sandwich."
8080260,808,24,"DOUCHE AND TURD","BALDING MAN","But Stan, don't you know, it's always between a giant douche and a turd sandwich. Nearly every election since the beginning of time has been between some douche and some turd. They're the only people who suck up enough to make it that far in politics."
8080261,808,24,"DOUCHE AND TURD","STAN","I guess... I guess you're right."
8080262,808,24,"DOUCHE AND TURD","PUFF DADDY","Yo, what did I say was going to happen to you, bitch?"
8080263,808,24,"DOUCHE AND TURD","STAN","AAAAAH!"
8080264,808,24,"DOUCHE AND TURD","MAN IN SHORTS","Aaaah!! He's wearing the skin of an animal!  Take that!  I... hope that teaches you a lesson about being hurt."
8080265,808,24,"DOUCHE AND TURD","PUFF DADDY","Itius, Rodicus!"
8080266,808,24,"DOUCHE AND TURD","BODYGUARD","Vote or die!"
8080267,808,24,"DOUCHE AND TURD","STAN","AAAAH!!"
8080268,808,24,"DOUCHE AND TURD","PETA MAN","Protect the animals! Protect the animals!"
8080269,808,24,"DOUCHE AND TURD","BALDING MAN","Janice, we shall die together in each other's arms!"
8080270,808,24,"DOUCHE AND TURD","OSTRICH-BABY","Kill me! Kill meee!!"
8080271,808,25,"DOUCHE AND TURD","description","South Park Elementary polling station. Mr. Mackey tallies up the votes."
8080272,808,25,"DOUCHE AND TURD","COUNSELOR MACKEY","M'kay, that's one more vote for Turd Sandwich."
8080273,808,25,"DOUCHE AND TURD","RANDY","So who won, Mr. Mackey?"
8080274,808,25,"DOUCHE AND TURD","COUNSELOR MACKEY","It's pretty close, but it looks like Giant Douche is gonna win."
8080275,808,25,"DOUCHE AND TURD","CARTMAN","Oh no! NOOO!!"
8080276,808,25,"DOUCHE AND TURD","KYLE","HA! You lose, fatass!"
8080277,808,25,"DOUCHE AND TURD","BUTTERS","Uh hey, wait a minute!"
8080278,808,25,"DOUCHE AND TURD","RANDY","Stan!"
8080279,808,25,"DOUCHE AND TURD","SHARON","Stan, you came back. Does that mean... you learned the importance of voting?"
8080280,808,25,"DOUCHE AND TURD","STAN","I learned that I'd better get used to having to pick between a douche and a turd sandwich because it's usually the choice I'll have."
8080281,808,25,"DOUCHE AND TURD","RANDY","He's going to vote!!"
8080282,808,25,"DOUCHE AND TURD","TOWNSFOLK","He's going to vote. He's going to vote."
8080283,808,25,"DOUCHE AND TURD","SINGER","Let's get out the vote! Let's make our voices heard!"
8080284,808,25,"DOUCHE AND TURD","We've been given the right to choose between a douche and a turd.",""
8080285,808,25,"DOUCHE AND TURD","It's democracy in action! Put your freedom to the test.",""
8080286,808,25,"DOUCHE AND TURD","A big fat turd or a stupid douche. Which do you like best?",""
8080287,808,25,"DOUCHE AND TURD","COUNSELOR MACKEY","Stan's vote bring the total votes for Turd Sandwich to... thirty six! And Giant Douche has... one thousand four hundred and ten. Giant Douche still wins."
8080288,808,25,"DOUCHE AND TURD","SOME TOWNSFOLK","Yeah! All right!"
8080289,808,25,"DOUCHE AND TURD","OTHER TOWNSFOLK","AWWWW!!"
8080290,808,25,"DOUCHE AND TURD","STAN","Dude, so my vote didn't even really matter!"
8080291,808,25,"DOUCHE AND TURD","RANDY","Hey! That's not true, Stan."
8080292,808,25,"DOUCHE AND TURD","SHARON","You can't judge the merits of voting on whether or not your candidate won."
8080293,808,25,"DOUCHE AND TURD","RANDY","Your vote still mattered."
8080294,808,25,"DOUCHE AND TURD","MR. GARRISON","Hey everybody!  They just found all the PETA members murdered at their compound!"
8080295,808,25,"DOUCHE AND TURD","COUNSELOR MACKEY","What the? They're all dead? Well, that means..."
8080296,808,25,"DOUCHE AND TURD","CLYDE","That we can go back to being the South Park Cows!"
8080297,808,25,"DOUCHE AND TURD","ALL","Hooray! All right!"
8080298,808,25,"DOUCHE AND TURD","RANDY","Naw, your vote didn't matter."
