"id","ep_num","segment","title","role","text"
9070224,907,20,"ERECTION DAY","CABBIE","Oh, thank you very much.  There you go. Have a good 'n."
9070225,907,20,"ERECTION DAY","JIMMY","Thank you."
9070226,907,20,"ERECTION DAY","CHEWMONEY","You're gonna pay for this, bitch!"
9070227,907,20,"ERECTION DAY","NUT GOBBLER","No! Heelllp!!  Haaaaaaaaaa!!"
9070228,907,20,"ERECTION DAY","JIMMY","Don't worry, Nut Gobbler! I'm coming! Oh Jesus, not now.  Oh boy, this is embarassing."
9070229,907,21,"ERECTION DAY","description","South Park Elementary Talent Show, now in progress. A magic act ends as the assistant steps out of a box"
9070230,907,21,"ERECTION DAY","MRS. GARRISON","And now we have Eric Cartman, who will be doing select readings from the movie, Scarface."
9070231,907,21,"ERECTION DAY","CARTMAN","D'you know what you are? You're all a bunch of fucking cock roaches! You need people like me! You need people like me so you can point your fucking finger and say ""That's the bad guy!"" Well say goodnight to the bad guy!!"
9070232,907,21,"ERECTION DAY","LIANE","That's my little boy."
9070233,907,22,"ERECTION DAY","description","Colfax Point, night. On the rooftop of the building, Chewmoney has Nut Gobbler on her knees and is ready to shoot her dead."
9070234,907,22,"ERECTION DAY","NUT GOBBLER","Please, Chewmoney! Don't do this!"
9070235,907,22,"ERECTION DAY","CHEWMONEY","I told you never to turn on me, ho!"
9070236,907,22,"ERECTION DAY","JIMMY","Hey, j-j-jackass!  I'm sorry I resorted to calling you jackass just now, but I'm very upset!"
9070237,907,22,"ERECTION DAY","CHEWMONEY","And what are you gonna do, huh?! I've got four feet on you AND a gun! What do you have?!"
9070238,907,22,"ERECTION DAY","JIMMY","What do I have? The weapon of comedy. So apparently the Chinese and the Japanese aren't getting along lately. Have you seen this? Have you heard about this?"
9070239,907,22,"ERECTION DAY","CHEWMONEY","What?!"
9070240,907,22,"ERECTION DAY","JIMMY","I'll tell you one thing: their food hasn't been getting along with my stomach for years."
9070241,907,22,"ERECTION DAY","CHEWMONEY","That's pretty good."
9070242,907,22,"ERECTION DAY","JIMMY","Martha Stewart is out of jail. Have you seen this? Have you heard about this?"
9070243,907,22,"ERECTION DAY","CHEWMONEY","Oh yeah. That's right, she is."
9070244,907,22,"ERECTION DAY","JIMMY","She's apparently gotten real good with baking cakes with keys in them."
9070245,907,22,"ERECTION DAY","NUT GOBBLER","Serves you right, you son of a bitch!"
9070246,907,22,"ERECTION DAY","JIMMY","Nice teamwork, Nut Gobbler."
9070247,907,22,"ERECTION DAY","GOBBLER","I can't believe you chased me all this way. You, you really care about me."
9070248,907,22,"ERECTION DAY","JIMMY","Not really. You're just a hooker, and I need to get laid. The talent show could be over any minute."
9070249,907,22,"ERECTION DAY","GOBBLER","That's good enough for me.  Take me to bed."
9070250,907,23,"ERECTION DAY","description","South Park Elementary Talent Show, now in progress. Ike is onstage singing ""Yankee Doodle Boy"""
9070251,907,23,"ERECTION DAY","IKE","I have a Yankee Doodle sweetheart,"
9070252,907,23,"ERECTION DAY","She's my Yankee Doodle girl.",""
9070253,907,24,"ERECTION DAY","description","holds up some sparklers"
9070254,907,24,"ERECTION DAY","'Ankee Doodle came to London,",""
9070255,907,24,"ERECTION DAY","Just to ride the ponies,",""
9070256,907,25,"ERECTION DAY","description","throws them off and gets inside a small cannon next to him. The barrel rises until it's in launch pisition"
9070257,907,25,"ERECTION DAY","I am da Yankee Doodle",""
9070258,907,25,"ERECTION DAY","I am da Yankee Doodle",""
9070259,907,25,"ERECTION DAY","I am da Yankee Doodle boy.",""
9070260,907,26,"ERECTION DAY","description","The cannon shoots him out and he lands clear across the stage. Some applause greets the performance. As the props are taken away, Ike takes off his hat and bows low to everyone, then puts on his top hat and walks off"
9070261,907,26,"ERECTION DAY","MRS. GARRISON","Okay, very nice, Ike, thank you. All right, children, it looks like we have no more contestants, which means, the Talent Show is over!"
9070262,907,26,"ERECTION DAY","PRINCIPAL VICTORIA","Mr. Mackey, it's over."
9070263,907,26,"ERECTION DAY","COUNSELOR MACKEY","Huh?  Oh oh oh, right."
9070264,907,26,"ERECTION DAY","MRS. GARRISON","Now we will tally up the judges' scores and find out which act they hated the least."
9070265,907,26,"ERECTION DAY","JIMMY","Hold everything!  Mrs. Garrison, if you don't mind, I'll be taking that microphone.."
9070266,907,26,"ERECTION DAY","Okay, let's put our hands together for ","Jimmy Valmer."
9070267,907,26,"ERECTION DAY","Wow, what a terrific audience. So apparently ","it's been exactly two years since the fall of Baghdad. Have you seen this? Have you heard about this? Just as B-Bush predicted, Baghdad fell, Iraq fell, Saddam fell. The only thing that didn't fall was ...the price of gas.  I just read in the paper that China's protesting Japan. Have you seen this? Have you heard about this? Yeah, I guess in China you don't get to-  You've gotta be kidding me."
